company,title,description,extraction_timestamp,search_title,search_location
Google,"Software Engineer III, Front End, Google Cloud AI","About the job
Minimum qualifications:

Bachelor’s degree or equivalent practical experience. 
2 years of experience with software development in one or more programming languages, or 1 year of experience with an advanced degree.
2 years of experience with front-end frameworks, full-stack development, or API development

Preferred qualifications:

Master's degree or PhD in Computer Science or related technical field. 
2 years of experience with performance, large scale systems data analysis, visualization tools, or debugging.
2 years of experience with data structures or algorithms in either an academic or industry setting.
Experience developing accessible technologies. 
Proficiency in code and system health, diagnosis and resolution, and software test engineering. 

About The Job

Google's software engineers develop the next-generation technologies that change how billions of users connect, explore, and interact with information and one another. Our products need to handle information at massive scale, and extend well beyond web search. We're looking for engineers who bring fresh ideas from all areas, including information retrieval, distributed computing, large-scale system design, networking and data storage, security, artificial intelligence, natural language processing, UI design and mobile; the list goes on and is growing every day. As a software engineer, you will work on a specific project critical to Google’s needs with opportunities to switch teams and projects as you and our fast-paced business grow and evolve. We need our engineers to be versatile, display leadership qualities and be enthusiastic to take on new problems across the full-stack as we continue to push technology forward.

With your technical expertise you will manage project priorities, deadlines, and deliverables. You will design, develop, test, deploy, maintain, and enhance software solutions.

Applied AI builds conversational agents deployed at a large scale that achieve very meaningful results in the real world. Some examples include the customer agent built for large call center environments, to fast food ordering handled by our Food AI agent. The team is transforming how enterprises connect with customers through the power of AI. We also offer unique experiences for team members where you get to work directly with the model builders (Google DeepMind / Vertex), learn and work with brilliant AI leaders, and have access to Global 1000 customers via our existing Google Cloud relationships. The opportunity in this space is tremendous.

The US base salary range for this full-time position is $141,000-$202,000 + bonus + equity + benefits. Our salary ranges are determined by role, level, and location. Within the range, individual pay is determined by work location and additional factors, including job-related skills, experience, and relevant education or training. Your recruiter can share more about the specific salary range for your preferred location during the hiring process.

Please note that the compensation details listed in US role postings reflect the base salary only, and do not include bonus, equity, or benefits. Learn more about benefits at Google .

Responsibilities

Write product or system development code. 
Participate in, or lead design reviews with peers and stakeholders to decide amongst available technologies. 
Review code developed by other developers and provide feedback to ensure best practices (e.g., style guidelines, checking code in, accuracy, testability, and efficiency). 
Contribute to existing documentation or educational content and adapt content based on product/program updates and user feedback. 
Triage product or system issues and debug/track/resolve by analyzing the sources of issues and the impact on hardware, network, or service operations and quality. 


Google is proud to be an equal opportunity workplace and is an affirmative action employer. We are committed to equal employment opportunity regardless of race, color, ancestry, religion, sex, national origin, sexual orientation, age, citizenship, marital status, disability, gender identity or Veteran status. We also consider qualified applicants regardless of criminal histories, consistent with legal requirements. See also Google's EEO Policy and EEO is the Law. If you have a disability or special need that requires accommodation, please let us know by completing our Accommodations for Applicants form .",2025-10-30 18:12:45.094177,Software Engineer,San Francisco
